[
  {
    "absolute_difference": null,
    "case_type": "mapping",
    "common_variable": "steps_per_day",
    "gold": {
      "common_variable": "steps_per_day",
      "review_status": "requires_human_review"
    },
    "outcome": "correct",
    "predicted": {
      "common_variable": "steps_per_day",
      "review_status": "requires_human_review"
    },
    "reason_codes": [],
    "source_study": "SYN-ACTI-MET",
    "source_variable": "daily_steps",
    "within_tolerance": null
  },
  {
    "absolute_difference": null,
    "case_type": "mapping",
    "common_variable": "mvpa_minutes",
    "gold": {
      "common_variable": "mvpa_minutes",
      "review_status": "requires_human_review"
    },
    "outcome": "correct",
    "predicted": {
      "common_variable": "mvpa_minutes",
      "review_status": "requires_human_review"
    },
    "reason_codes": [],
    "source_study": "SYN-ACTI-MET",
    "source_variable": "mvpa_min",
    "within_tolerance": null
  },
  {
    "absolute_difference": null,
    "case_type": "mapping",
    "common_variable": "fat_mass",
    "gold": {
      "common_variable": "fat_mass",
      "review_status": "requires_human_review"
    },
    "outcome": "correct",
    "predicted": {
      "common_variable": "fat_mass",
      "review_status": "requires_human_review"
    },
    "reason_codes": [],
    "source_study": "SYN-ACTI-MET",
    "source_variable": "total_fat_mass",
    "within_tolerance": null
  },
  {
    "absolute_difference": null,
    "case_type": "mapping",
    "common_variable": "insulin",
    "gold": {
      "common_variable": "insulin",
      "review_status": "accepted"
    },
    "outcome": "correct",
    "predicted": {
      "common_variable": "insulin",
      "review_status": "accepted"
    },
    "reason_codes": [],
    "source_study": "SYN-CPET-RICH",
    "source_variable": "insulin",
    "within_tolerance": null
  },
  {
    "absolute_difference": null,
    "case_type": "mapping",
    "common_variable": "lean_mass",
    "gold": {
      "common_variable": "lean_mass",
      "review_status": "requires_human_review"
    },
    "outcome": "correct",
    "predicted": {
      "common_variable": "lean_mass",
      "review_status": "requires_human_review"
    },
    "reason_codes": [],
    "source_study": "SYN-CPET-RICH",
    "source_variable": "total_lean_mass",
    "within_tolerance": null
  },
  {
    "absolute_difference": null,
    "case_type": "mapping",
    "common_variable": "vo2max",
    "gold": {
      "common_variable": "vo2max",
      "review_status": "requires_human_review"
    },
    "outcome": "correct",
    "predicted": {
      "common_variable": "vo2max",
      "review_status": "requires_human_review"
    },
    "reason_codes": [],
    "source_study": "SYN-CPET-RICH",
    "source_variable": "vo2peak",
    "within_tolerance": null
  },
  {
    "absolute_difference": null,
    "case_type": "mapping",
    "common_variable": "bmi",
    "gold": {
      "common_variable": "bmi",
      "review_status": "requires_human_review"
    },
    "outcome": "correct",
    "predicted": {
      "common_variable": "bmi",
      "review_status": "requires_human_review"
    },
    "reason_codes": [],
    "source_study": "SYN-DIET-BODY",
    "source_variable": "body_mass_index",
    "within_tolerance": null
  },
  {
    "absolute_difference": null,
    "case_type": "mapping",
    "common_variable": "not_mapped",
    "gold": {
      "common_variable": "not_mapped",
      "review_status": "rejected"
    },
    "outcome": "correct",
    "predicted": {
      "common_variable": "not_mapped",
      "review_status": "rejected"
    },
    "reason_codes": [],
    "source_study": "SYN-DIET-BODY",
    "source_variable": "diet_score",
    "within_tolerance": null
  },
  {
    "absolute_difference": null,
    "case_type": "mapping",
    "common_variable": "lean_mass",
    "gold": {
      "common_variable": "lean_mass",
      "review_status": "requires_human_review"
    },
    "outcome": "correct",
    "predicted": {
      "common_variable": "lean_mass",
      "review_status": "requires_human_review"
    },
    "reason_codes": [],
    "source_study": "SYN-DIET-BODY",
    "source_variable": "dxa_lean_mass",
    "within_tolerance": null
  },
  {
    "absolute_difference": null,
    "case_type": "mapping",
    "common_variable": "vo2max",
    "gold": {
      "common_variable": "vo2max",
      "review_status": "requires_human_review"
    },
    "outcome": "correct",
    "predicted": {
      "common_variable": "vo2max",
      "review_status": "requires_human_review"
    },
    "reason_codes": [],
    "source_study": "SYN-EXER-NODATA",
    "source_variable": "peak_vo2",
    "within_tolerance": null
  },
  {
    "absolute_difference": null,
    "case_type": "mapping",
    "common_variable": "not_mapped",
    "gold": {
      "common_variable": "not_mapped",
      "review_status": "rejected"
    },
    "outcome": "correct",
    "predicted": {
      "common_variable": "not_mapped",
      "review_status": "rejected"
    },
    "reason_codes": [],
    "source_study": "SYN-MET-NOCODEBOOK",
    "source_variable": "metab_feature_001",
    "within_tolerance": null
  },
  {
    "absolute_difference": null,
    "case_type": "mapping",
    "common_variable": "age",
    "gold": {
      "common_variable": "age",
      "review_status": "accepted"
    },
    "outcome": "correct",
    "predicted": {
      "common_variable": "age",
      "review_status": "accepted"
    },
    "reason_codes": [],
    "source_study": "SYN-METEX-GEN",
    "source_variable": "age",
    "within_tolerance": null
  },
  {
    "absolute_difference": null,
    "case_type": "mapping",
    "common_variable": "bmi",
    "gold": {
      "common_variable": "bmi",
      "review_status": "accepted"
    },
    "outcome": "correct",
    "predicted": {
      "common_variable": "bmi",
      "review_status": "accepted"
    },
    "reason_codes": [],
    "source_study": "SYN-METEX-GEN",
    "source_variable": "bmi",
    "within_tolerance": null
  },
  {
    "absolute_difference": null,
    "case_type": "mapping",
    "common_variable": "fasting_glucose",
    "gold": {
      "common_variable": "fasting_glucose",
      "review_status": "accepted"
    },
    "outcome": "correct",
    "predicted": {
      "common_variable": "fasting_glucose",
      "review_status": "accepted"
    },
    "reason_codes": [],
    "source_study": "SYN-METEX-GEN",
    "source_variable": "fasting_glucose",
    "within_tolerance": null
  },
  {
    "absolute_difference": null,
    "case_type": "mapping",
    "common_variable": "sex",
    "gold": {
      "common_variable": "sex",
      "review_status": "accepted"
    },
    "outcome": "correct",
    "predicted": {
      "common_variable": "sex",
      "review_status": "accepted"
    },
    "reason_codes": [],
    "source_study": "SYN-METEX-GEN",
    "source_variable": "sex",
    "within_tolerance": null
  },
  {
    "absolute_difference": null,
    "case_type": "mapping",
    "common_variable": "vo2max",
    "gold": {
      "common_variable": "vo2max",
      "review_status": "accepted"
    },
    "outcome": "correct",
    "predicted": {
      "common_variable": "vo2max",
      "review_status": "accepted"
    },
    "reason_codes": [],
    "source_study": "SYN-METEX-GEN",
    "source_variable": "vo2max",
    "within_tolerance": null
  },
  {
    "absolute_difference": null,
    "case_type": "mapping",
    "common_variable": "fat_mass",
    "gold": {
      "common_variable": "fat_mass",
      "review_status": "accepted"
    },
    "outcome": "correct",
    "predicted": {
      "common_variable": "fat_mass",
      "review_status": "accepted"
    },
    "reason_codes": [],
    "source_study": "SYN-MOTRPAC-LIKE",
    "source_variable": "fat_mass",
    "within_tolerance": null
  },
  {
    "absolute_difference": null,
    "case_type": "mapping",
    "common_variable": "lean_mass",
    "gold": {
      "common_variable": "lean_mass",
      "review_status": "accepted"
    },
    "outcome": "correct",
    "predicted": {
      "common_variable": "lean_mass",
      "review_status": "accepted"
    },
    "reason_codes": [],
    "source_study": "SYN-MOTRPAC-LIKE",
    "source_variable": "lean_mass",
    "within_tolerance": null
  },
  {
    "absolute_difference": null,
    "case_type": "mapping",
    "common_variable": "mvpa_minutes",
    "gold": {
      "common_variable": "mvpa_minutes",
      "review_status": "accepted"
    },
    "outcome": "correct",
    "predicted": {
      "common_variable": "mvpa_minutes",
      "review_status": "accepted"
    },
    "reason_codes": [],
    "source_study": "SYN-MOTRPAC-LIKE",
    "source_variable": "mvpa_minutes",
    "within_tolerance": null
  },
  {
    "absolute_difference": null,
    "case_type": "mapping",
    "common_variable": "steps_per_day",
    "gold": {
      "common_variable": "steps_per_day",
      "review_status": "accepted"
    },
    "outcome": "correct",
    "predicted": {
      "common_variable": "steps_per_day",
      "review_status": "accepted"
    },
    "reason_codes": [],
    "source_study": "SYN-MOTRPAC-LIKE",
    "source_variable": "steps_per_day",
    "within_tolerance": null
  },
  {
    "absolute_difference": null,
    "case_type": "mapping",
    "common_variable": "vo2max",
    "gold": {
      "common_variable": "vo2max",
      "review_status": "accepted"
    },
    "outcome": "correct",
    "predicted": {
      "common_variable": "vo2max",
      "review_status": "accepted"
    },
    "reason_codes": [],
    "source_study": "SYN-MOTRPAC-LIKE",
    "source_variable": "vo2max",
    "within_tolerance": null
  },
  {
    "absolute_difference": null,
    "case_type": "mapping",
    "common_variable": "insulin",
    "gold": {
      "common_variable": "insulin",
      "review_status": "requires_human_review"
    },
    "outcome": "correct",
    "predicted": {
      "common_variable": "insulin",
      "review_status": "requires_human_review"
    },
    "reason_codes": [],